{
  "url": "https://swarmsync.ai",
  "dom_hash": "sha256:26018ff3bc8414282c6b50ed086debc564b4a9a5fe914acb07b014e1a755d94b",
  "timestamp": "2026-03-14T10:22:01.000000000Z",
  "signature": "unsigned",
  "scanner_version_hash": "sha256:6f07214e12d2aa094a385dd5d092b36fc04b3fff71666331541a857072f57886",
  "scan_origin": "local"
}
